anime_id,name,genre,type,episodes,rating,members
8896,Natsufuku no Shoujo-tachi,"Drama, Historical",Special,1,6.41,347
28963,Nekota no Koto ga Kininatte Shikatanai.,"School, Shoujo",Special,1,6.41,612
18639,Rinne no Lagrange Season 2 Specials,Comedy,Special,6,6.41,1599
33192,Robot Town Sagami 2028,Drama,ONA,1,6.41,386
6979,Shukufuku no Campanella,"Adventure, Fantasy, Harem, Magic",TV,12,6.41,20054
1713,Submarine Super 99,"Action, Adventure, Military, Sci-Fi, Shounen",TV,13,6.41,684
2027,Wind: A Breath of Heart Specials,"Comedy, Romance, School",Special,4,6.41,1335
8985,Yojouhan Shinwa Taikei Specials,Comedy,Special,3,6.41,10005
21861,Airy Me,"Dementia, Drama, Horror, Music",Music,1,6.40,1561
5112,Akikan!,"Comedy, Ecchi, Fantasy, Romance",TV,12,6.40,74097
6287,Akikan!: Kan Ippatsu!? Onsen Panic,"Comedy, Ecchi",OVA,1,6.40,17949
10526,Duel Masters Zero,"Action, Kids",TV,25,6.40,795
5375,Gakkyuu Ou Yamazaki,Comedy,TV,53,6.40,465
3671,"Genesis Climber Mospeada: Love, Live, Alive","Action, Mecha, Music",OVA,1,6.40,712
2474,Ginga Ojousama Densetsu Yuna: Shin&#039;en no Fairy,"Action, Adventure, Comedy, Magic, Mecha, Sci-Fi",OVA,3,6.40,1256
16740,Hanamaru Youchien Special Preview,"Comedy, School",Special,1,6.40,1093
22443,Hello Kitty no Alps no Shoujo Heidi,Kids,OVA,1,6.40,153
28911,Hidamari Sketch Recap,"Comedy, School, Slice of Life",Special,1,6.40,455
28883,Hidan no Aria AA,"Action, School, Shoujo Ai",TV,12,6.40,39538
360,Himiko-den,"Adventure, Drama, Fantasy, Supernatural",TV,12,6.40,3731
3839,Himitsu no Akko-chan 3,"Magic, School, Shoujo",TV,44,6.40,378
7729,Hokkyoku no Muushika Miishika,Adventure,Movie,1,6.40,172
21077,Kakumeiki Valvrave Recaps,"Action, Mecha",ONA,3,6.39,1924
2075,Kiko-chan Smile,"Adventure, Comedy, Josei, Slice of Life",TV,51,6.40,297
2526,Kirara,"Comedy, Ecchi, Romance, Slice of Life, Supernatural",OVA,1,6.40,1596
19575,Kobayashi ga Kawai sugite Tsurai!!,"Romance, School, Shoujo",OVA,2,6.40,4251
6227,Lovedol: Lovely Idol OVA,"Comedy, Drama, Ecchi, Harem, Music",OVA,1,6.40,1135
1503,Mahou Shoujo Pretty Sammy Specials,"Adventure, Comedy, Fantasy, Magic, Parody, Seinen",Special,7,6.40,798
1580,Mouryou Senki Madara,"Adventure, Demons, Shounen, Supernatural",OVA,2,6.40,813
749,Nanami-chan,"Comedy, Kids",TV,12,6.40,828
13681,Nekogami Yaoyorozu Specials,"Comedy, Seinen, Supernatural",Special,7,6.40,915
19731,Osamu to Musashi,"Adventure, Fantasy, Kids",Movie,1,6.40,143
3768,Play Ball,"Action, Shounen, Sports",TV,13,6.40,413
980,Rikujou Bouei-tai Mao-chan,"Comedy, Kids, Magic, Military, Sci-Fi",TV,26,6.40,2934
11049,Shin Maple Town Monogatari: Palm Town-hen - Konnichiwa! Atarashii Machi,"Fantasy, Slice of Life",Movie,1,6.40,185
1500,Teizokurei Daydream,"Comedy, Drama, Ecchi, Horror, Supernatural",OVA,4,6.40,5305
10594,Tokimeki Tonight Recaps,"Comedy, Fantasy, Romance, Shoujo, Vampire",Special,2,6.40,220
33247,Tsubasa to Hotaru (2016),"Romance, School, Shoujo",Special,3,6.40,1411
9566,Umi kara no Shisha,"Action, Mecha, Sci-Fi, Super Power",Movie,1,6.40,826
30751,Usavich Zero,Comedy,TV,13,6.40,619
4420,Vampiyan Kids: Pilot,"Action, Comedy, Kids, Vampire",Special,1,6.40,435
4591,Yoiko,"Comedy, School, Slice of Life",TV,20,6.40,2238
1583,009-1,"Action, Mecha, Sci-Fi, Seinen",TV,12,6.39,11097
26189,Ai Tenshi Densetsu Wedding Peach Specials,"Adventure, Comedy, Magic, Romance, Shoujo",Special,2,6.39,446
15085,Amnesia,"Fantasy, Josei, Mystery, Romance",TV,12,6.39,134349
7779,Andersen Monogatari (TV),"Drama, Fantasy, Kids",TV,52,6.39,389
7752,Bao Lian Deng,"Action, Adventure, Fantasy",Movie,1,6.39,225
34173,Buddy Go! 2,"Comedy, Romance, Shoujo",Special,4,6.39,304
14277,Chitose Get You!!,"Comedy, Romance, School, Seinen, Slice of Life",TV,26,6.39,12886
22733,Dragon Collection,"Fantasy, Shounen",TV,51,6.39,3229
6062,Duel Masters Movie 2: Lunatic God Saga,"Action, Adventure, Comedy, Shounen",Movie,1,6.39,522
32785,Future Card Buddyfight DDD,Game,TV,Unknown,6.39,912
8157,Gegege no Kitarou: Youkai Tokkyuu! Maboroshi no Kisha,"Adventure, Comedy, Fantasy, Horror, Supernatural",Movie,1,6.39,241
3906,H. P. Lovecraft&#039;s The Dunwich Horror and Other Stories,Horror,OVA,1,6.39,1704
2281,Jikuu Tantei Genshi-kun,"Adventure, Comedy, Fantasy, Mystery, Sci-Fi, Shounen",TV,39,6.39,5541
9748,Kaze wo Nuke!,Sports,OVA,1,6.39,187
7505,Knyacki!,"Comedy, Drama, Fantasy, Kids",ONA,Unknown,6.38,242
1591,Kujibiki♥Unbalance,"Comedy, Romance, School",TV,12,6.39,9021
10755,Lupin tai Holmes,Mystery,Special,1,6.39,331
3475,Muramasa,"Historical, Horror, Martial Arts, Samurai",Movie,1,6.39,2535
15881,Oniichan dakedo Ai Sae Areba Kankeinai yo ne! Specials,"Comedy, Ecchi",Special,6,6.39,16618
31927,Phantom of the Kill: Zero kara no Hangyaku,"Action, Adventure, Fantasy",Movie,1,6.39,4893
25365,Pokemon XY: Koukoku no Princess Diancie,"Comedy, Fantasy, Kids",Special,1,6.40,2829
8840,Senkou no Night Raid: Yogen,"Action, Historical, Military, Super Power",Special,1,6.39,2752
23433,Shin Strange+,"Comedy, Shoujo, Slice of Life",TV,12,6.39,9385
25883,Taisei Kensetsu: Vietnam Noi Bai Kuukou,Drama,Special,1,6.39,2258
2679,Teki wa Kaizoku: Neko-tachi no Kyouen,"Comedy, Sci-Fi",OVA,6,6.39,720
4533,Uchuu Kazoku Carlvinson,"Comedy, Fantasy, Sci-Fi",OVA,1,6.39,649
9100,Umi Monogatari: Marin no Kore Naani?,Comedy,Special,4,6.39,1229
8249,Votoms Finder,"Action, Drama, Mecha, Military, Sci-Fi",OVA,1,6.39,1735
12123,Yurumates 3D,"Comedy, Seinen, Slice of Life",TV,13,6.39,5678
6094,A Piece of Phantasmagoria,"Fantasy, Kids",OVA,15,6.38,1862
13859,Accel World: Acchel World.,"Comedy, Sci-Fi",Special,8,6.38,26190
17167,Akai Koudan Zillion Specials,"Adventure, Sci-Fi, Shounen",Special,3,6.38,262
2789,B-Densetsu! Battle Bedaman,"Adventure, Fantasy, Kids, Shounen",TV,52,6.38,6545
2156,Bakugan Battle Brawlers,"Action, Fantasy, Game",TV,52,6.38,25846
301,Cinderella Boy,"Action, Adventure, Comedy, Mystery",TV,13,6.38,3246
13807,Corpse Party: Missing Footage,"Horror, School",OVA,1,6.38,57507
29165,Daitoshokan no Hitsujikai Picture Drama,"Comedy, Ecchi",Special,6,6.38,2487
32264,Dear Brave,"Music, Romance",Music,1,6.38,522
1337,Dororon Enma-kun,"Comedy, Demons, Fantasy, Horror, Shounen, Supernatural",TV,25,6.38,1898
1344,Eightman After,"Action, Drama, Sci-Fi",OVA,4,6.38,1771
24675,Future Card Buddyfight Recap,Game,Special,1,6.38,277
16912,gdgd Fairies 2 Episode 0,"Comedy, Fantasy",Special,1,6.38,367
6271,Gendai Kibunroku Kaii Monogatari,Horror,OVA,1,6.38,704
581,Honoo no Labyrinth,"Adventure, Comedy, Ecchi, Samurai",OVA,2,6.38,5958
2523,Izumo: Takeki Tsurugi no Senki,"Adventure, Drama, Fantasy, Martial Arts, Romance, Supernatural",TV,12,6.38,7748
10132,Jin Sheng Yuan,Music,Music,1,6.38,406
7170,Kataku,"Demons, Historical, Supernatural",Movie,1,6.38,1025
23341,Mahouka Koukou no Rettousei: Yoku Wakaru Mahouka!,"Comedy, Magic",ONA,6,6.38,13068
15717,Nagareboshi Lens Specials,"Romance, Shoujo",Special,3,6.38,1557
19351,Nijiiro☆Prism Girl,"Comedy, Romance, School, Shoujo",OVA,4,6.38,1390
9731,Nurarihyon no Mago Recaps,"Action, Demons, Shounen, Supernatural",Special,2,6.38,9781
1547,Obake no Q-tarou,"Comedy, School, Slice of Life, Supernatural",TV,96,6.38,250
29511,Ongaku Shoujo,"Music, Slice of Life",Movie,1,6.38,6289
3004,Saint Beast: Ikusen no Hiru to Yoru-hen,"Fantasy, Magic",OVA,2,6.38,2708
1508,Sci-fi Harry,"Drama, Horror, Sci-Fi",TV,20,6.38,5194
5693,"Shinran-sama: Negai, Soshite Hikari",Historical,OVA,1,6.38,150
13175,Shiranpuri (Movie),"Drama, School",Movie,1,6.38,3104
6437,Sora wo Kakeru Shoujo Picture Drama,"Adventure, Comedy, Sci-Fi, Space",Special,9,6.38,1716
